{
  "$schema": "https://json-schema.org/draft/2020-12/schema",
  "$id": "https://local.qa-cumplimiento/schemas/qe-result.schema.json",
  "title": "QA Compliance Result",
  "type": "object",
  "required": [
    "schema_version",
    "run_id",
    "tool",
    "category",
    "status",
    "started_at",
    "finished_at",
    "summary",
    "checks"
  ],
  "properties": {
    "schema_version": {
      "type": "string",
      "const": "1.0"
    },
    "run_id": {
      "type": "string",
      "minLength": 1
    },
    "tool": {
      "type": "string",
      "minLength": 1
    },
    "category": {
      "type": "string",
      "enum": ["e2e", "load", "dependency", "secret", "sast", "compliance", "manual"]
    },
    "status": {
      "type": "string",
      "enum": ["pass", "fail", "skipped"]
    },
    "started_at": {
      "type": "string",
      "format": "date-time"
    },
    "finished_at": {
      "type": "string",
      "format": "date-time"
    },
    "summary": {
      "type": "string"
    },
    "checks": {
      "type": "array",
      "items": {
        "type": "object",
        "required": ["name", "status", "message"],
        "properties": {
          "name": {
            "type": "string",
            "minLength": 1
          },
          "status": {
            "type": "string",
            "enum": ["pass", "fail", "skipped"]
          },
          "message": {
            "type": "string"
          },
          "details": {
            "type": "object"
          }
        },
        "additionalProperties": false
      }
    },
    "artifacts": {
      "type": "array",
      "items": {
        "type": "string"
      }
    }
  },
  "additionalProperties": false
}

