{
  "schema_version": "1.0",
  "run_id": "dependency-audit-20260703T213020Z",
  "tool": "dependency-audit",
  "category": "dependency",
  "status": "pass",
  "started_at": "2026-07-03T21:30:20Z",
  "finished_at": "2026-07-03T21:30:47Z",
  "summary": "Escaneo de dependencias completado sin hallazgos bloqueantes.",
  "checks": [
    {
      "name": "npm-audit",
      "status": "pass",
      "message": "npm audit finalizo sin vulnerabilidades bloqueantes.",
      "details": {
        "exit_code": 0,
        "lockfiles": [
          "package-lock.json"
        ]
      }
    },
    {
      "name": "pip-audit:requirements.txt",
      "status": "pass",
      "message": "pip-audit finalizo sin vulnerabilidades conocidas.",
      "details": {
        "exit_code": 0,
        "requirements": "requirements.txt"
      }
    }
  ],
  "artifacts": [
    "resultados/dependency-audit-20260703T213020Z-npm-audit.raw.json",
    "resultados/dependency-audit-20260703T213020Z-requirements.raw.json"
  ]
}
