{
  "schema_version": "1.0",
  "run_id": "secret-scan-20260705T055201Z",
  "tool": "secret-scan",
  "category": "secret",
  "status": "pass",
  "started_at": "2026-07-05T05:52:01Z",
  "finished_at": "2026-07-05T05:52:07Z",
  "summary": "Escaneo de secretos completado sin hallazgos.",
  "checks": [
    {
      "name": "fallback-secret-regex",
      "status": "pass",
      "message": "Escaneo regex fallback no encontro secretos.",
      "details": {
        "scanned_files": 362,
        "findings": 0,
        "note": "Instalar gitleaks o trufflehog mejora cobertura y reduce falsos negativos."
      }
    }
  ],
  "artifacts": [
    "resultados/secret-scan-20260705T055201Z-fallback-findings.json"
  ]
}
