{
  "schema_version": "1.0",
  "run_id": "chat-consistency-20260708T223646Z",
  "tool": "chat-consistency-capture",
  "category": "compliance",
  "status": "fail",
  "started_at": "2026-07-08T22:36:47Z",
  "finished_at": "2026-07-08T22:38:03Z",
  "summary": "Captura de consistencia de chat encontro variacion o errores; revisar raw report.",
  "checks": [
    {
      "name": "SEM-INV-OWN-001",
      "status": "fail",
      "message": "Se capturaron 2 respuestas normalizadas distintas o errores.",
      "details": {
        "prompt": "¿Quién tiene asignada la laptop LAP-MKT-0042?",
        "group": "inventory-asset-owner",
        "intent": "specific_asset_owner",
        "variant": "canonical",
        "expected": {
          "decision": "answer",
          "tool_budget": "inventory or CMDB lookup acceptable; do not invent owner if the asset is not registered",
          "safety": "use only registered inventory data",
          "equivalence_key": "inventory-owner-lap-mkt-0042",
          "acceptance_criteria": [
            "must return the same owner or same no-data statement as the other LAP-MKT-0042 variants",
            "must not infer ownership from department code alone",
            "respuesta real observada 2026-07-08: LAP-MKT-0042 no está registrada en el CMDB/NetBox; se espera un statement de 'no encontrado', nunca un dueño inventado"
          ],
          "format": "",
          "answer_shape": "",
          "must_mention": [],
          "must_mention_any": [
            [
              "no encontré",
              "no está registrad",
              "sin registros",
              "no existe",
              "no se encontraron"
            ]
          ],
          "must_not_mention": []
        },
        "repeats": 2,
        "unique_normalized_responses": 2,
        "response_hashes": [
          "4638f2f57713e5a6aa3288a37d52ebc57e583e74a4795ae93eac35e0a84afc72",
          "ce57ee0aed546cc174f702dd8e888593e6a2aea78213196e2bfb8769b1bdad8e"
        ],
        "normalized_hashes": [
          "dc6e2cb69b9fa3e6b9a8ff49dbdb63c2ac9d6e7cc994371115110c2439a25fb9",
          "2dce1eba69f8aa2fd2040fd6c972e4dbbd5a774d16c8cb88877dd10807bbb072"
        ],
        "latencies_ms": [
          5539,
          6146
        ],
        "tool_call_names": [
          [
            "lookup_host"
          ],
          [
            "lookup_host"
          ]
        ],
        "expectation_violations": []
      }
    },
    {
      "name": "SEM-INV-RAM-001",
      "status": "fail",
      "message": "Se capturaron 2 respuestas normalizadas distintas o errores.",
      "details": {
        "prompt": "¿Cuánta RAM tiene el servidor SRV-DB-01?",
        "group": "inventory-technical-attributes",
        "intent": "server_ram",
        "variant": "canonical",
        "expected": {
          "decision": "answer",
          "tool_budget": "inventory or CMDB lookup acceptable; do not invent RAM value if server is not registered",
          "safety": "use only registered inventory data",
          "equivalence_key": "inventory-ram-srv-db-01",
          "acceptance_criteria": [
            "must use a consistent unit and value across all SRV-DB-01 RAM variants",
            "must not switch between GB and MB inconsistently",
            "respuesta real observada 2026-07-08: SRV-DB-01 no está en el inventario; se espera un statement de 'no encontrado', nunca una RAM inventada"
          ],
          "format": "",
          "answer_shape": "",
          "must_mention": [],
          "must_mention_any": [
            [
              "no encontré",
              "no está registrad",
              "sin registros",
              "no existe",
              "no se encontraron"
            ]
          ],
          "must_not_mention": []
        },
        "repeats": 2,
        "unique_normalized_responses": 2,
        "response_hashes": [
          "d6dcad6e15b2816cb1c81e0652db8de965893652b71190666de5391f3b97f5d5",
          "8db118745583c49480568ef731755e3bb7ff8eb67d839e61da088b1cc541db80"
        ],
        "normalized_hashes": [
          "d39fea6bffd03a7688ad460aeba24fc1788958c8853784e893d515f537b2c0ef",
          "81cbe97d594b6b4064c5f491b056994e00adaa706ed652c0229d50b1b9a9441f"
        ],
        "latencies_ms": [
          4101,
          4035
        ],
        "tool_call_names": [
          [
            "lookup_host"
          ],
          [
            "lookup_host"
          ]
        ],
        "expectation_violations": []
      }
    },
    {
      "name": "SEM-INV-COUNT-001",
      "status": "fail",
      "message": "Se capturaron 2 respuestas normalizadas distintas o errores.",
      "details": {
        "prompt": "¿Cuántas laptops hay en el inventario?",
        "group": "inventory-aggregates",
        "intent": "laptop_count",
        "variant": "canonical",
        "expected": {
          "decision": "answer",
          "tool_budget": "inventory aggregate lookup acceptable; do not estimate",
          "safety": "use only registered inventory data",
          "answer_shape": "count",
          "equivalence_key": "inventory-laptop-count",
          "acceptance_criteria": [
            "must return the same numeric count across all laptop count variants",
            "respuesta real observada 2026-07-08: no hay hosts con el término 'laptop' en el CMDB; se espera 'sin resultados', nunca un conteo inventado"
          ],
          "format": "",
          "must_mention": [],
          "must_mention_any": [
            [
              "no encontré",
              "no hay",
              "sin hosts",
              "no están registrad",
              "no se encontraron"
            ]
          ],
          "must_not_mention": []
        },
        "repeats": 2,
        "unique_normalized_responses": 2,
        "response_hashes": [
          "7090247f99c3626cb33f6f9db7958dcd1d30510c4fb6bc311090437758e22b95",
          "77c69ae222c379734478928853cb9aebaed10f9ec96f5c8a38e636c7d9055c07"
        ],
        "normalized_hashes": [
          "9ff145ecf321b84bdf1bf8edf37ca6519ae8114a9eee63b0caf6b2c0cf28e043",
          "4eaa154ef49d53c197cebed00d405799edb6147f6e74e95ae043fb760dfe4c04"
        ],
        "latencies_ms": [
          7798,
          34156
        ],
        "tool_call_names": [
          [
            "lookup_host",
            "lookup_host",
            "lookup_host",
            "lookup_host",
            "lookup_host",
            "lookup_host"
          ],
          [
            "generate_report"
          ]
        ],
        "expectation_violations": [
          "missing concrete count answer.",
          "missing one of expected phrases: no encontré | no hay | sin hosts | no están registrad | no se encontraron",
          "equivalent prompts for inventory-laptop-count returned 2 distinct semantic outcomes."
        ]
      }
    },
    {
      "name": "SEM-INV-WAR-001",
      "status": "fail",
      "message": "Se capturaron 2 respuestas normalizadas distintas o errores.",
      "details": {
        "prompt": "¿Cuántos equipos están fuera de garantía?",
        "group": "inventory-derived-numeric",
        "intent": "expired_warranty",
        "variant": "count",
        "expected": {
          "decision": "answer",
          "tool_budget": "inventory aggregate lookup acceptable; do not estimate",
          "safety": "use only registered warranty dates",
          "answer_shape": "expired_warranty_count",
          "acceptance_criteria": [
            "count, percentage and list must be mutually consistent",
            "must not estimate without inventory data",
            "valor real observado 2026-07-08: 691 equipos fuera de garantía en el inventario (alcance Cámara de Diputados); el conteo debe reportar 691"
          ],
          "format": "",
          "equivalence_key": "",
          "must_mention": [
            "691"
          ],
          "must_mention_any": [],
          "must_not_mention": []
        },
        "repeats": 2,
        "unique_normalized_responses": 2,
        "response_hashes": [
          "009791505862be1d5758e61bc9a8ba8e90f526c93a7fb471609db21f88bfe3e2",
          "556464573e82bece93a47db269de98ca1220195070b6f90e278d9bad5339ad9c"
        ],
        "normalized_hashes": [
          "ce7197a00a360b3016dec1ef3d2a15411a8f15cad27a1194a3b4f6346c41e65f",
          "a2c3cb6b47d444ef289c4d8245b1d92d6434886d57960301a6ac2998183e3f20"
        ],
        "latencies_ms": [
          6794,
          7823
        ],
        "tool_call_names": [
          [
            "generate_report",
            "get_dashboard_stats",
            "search_cases"
          ],
          [
            "generate_report",
            "search_cases",
            "lookup_host"
          ]
        ],
        "expectation_violations": [
          "missing expected phrase: 691",
          "missing concrete expired warranty count answer.",
          "missing expected phrase: 691",
          "missing concrete expired warranty count answer."
        ]
      }
    }
  ],
  "artifacts": [
    "resultados/chat-consistency-20260708T223646Z.raw.json"
  ]
}
